{"key":"content:_collections:partners:technology:2.layer-0.md","generatedAt":"2022-04-23T02:06:39.009Z","mtime":"2022-04-23T02:06:39.008Z","slug":"layer-0","title":"Layer 0","position":"999999999999","to":"/collections/partners/technology/layer-0","draft":false,"page":false,"language":"en","description":"Layer0 is a platform to manage and run your frontend for instant loads. Infrastructure for sub-second dynamic websites. Develop, deploy, preview, experiment on, monitor and run your frontend.","icon":"layer0.svg","logo":{"light":"/img/companies/square/light/layer0.svg","dark":"/img/companies/square/dark/layer0.svg"},"logoFull":"/img/companies/full/dark/layer0.svg","link":"https://www.layer0.co/?ref=nuxt","fullDescription":"Our mission is to make the Web instant and simple. We've built the first and only platform that enables sub-second speeds for large database driven sites while making it much simpler to manage your modern frontend","services":["Hosting","Cloud","Serverless"],"resources":[{"name":"Get started with Layer0 and Nuxt","url":"https://docs.layer0.co/guides/nuxt"}],"emailAddress":null,"phoneNumber":null,"twitter":"Layer0Deploy","github":"layer0-platform","color":["#6159f6","#e95495"],"empty":true,"body":{"raw":"---\ntitle: \"Layer 0\"\ndescription: \"Layer0 is a platform to manage and run your frontend for instant loads. Infrastructure for sub-second dynamic websites. Develop, deploy, preview, experiment on, monitor and run your frontend.\"\nicon: layer0.svg\nlogo: \n  light: \"/img/companies/square/light/layer0.svg\"\n  dark: \"/img/companies/square/dark/layer0.svg\"\nlogoFull: \"/img/companies/full/dark/layer0.svg\"\nlink: https://www.layer0.co/?ref=nuxt\nfullDescription: \"Our mission is to make the Web instant and simple. We've built the first and only platform that enables sub-second speeds for large database driven sites while making it much simpler to manage your modern frontend\"\nservices:\n  - Hosting\n  - Cloud\n  - Serverless\nresources:\n  -\n    name: 'Get started with Layer0 and Nuxt'\n    url: 'https://docs.layer0.co/guides/nuxt'\nemailAddress:\nphoneNumber:\ntwitter: 'Layer0Deploy'\ngithub: 'layer0-platform'\ncolor:\n  - '#6159f6'\n  - '#e95495'\n---\n","ast":{"type":"root","children":[]},"toc":{"title":"","searchDepth":2,"depth":2,"links":[]}}}