{"key":"content:zh:_collections:events:2019.md","generatedAt":"2022-04-23T02:06:43.256Z","mtime":"2022-04-23T02:06:43.255Z","slug":"2019","title":"2019","position":"999999999999","to":"/collections/events/2019","draft":false,"page":false,"language":"zh","events":[{"name":"ReactiveConf 2019","title":"Be Lazy, Be Smart, Be Nuxt","speaker":"Sébastien Chopin","description":"Sebastien demonstrates how to create a web application quickly by using Nuxt and explaining how it works under the hood. Giving you confidence for your next Vue applications.","logo":"https://pbs.twimg.com/profile_images/1042510623962275840/1Iw_Mvud_400x400.jpg","eventLogo":"reactive_conf.svg","eventLink":"https://reactiveconf.com/","link":"https://youtu.be/vbsPXHCu8Xg","date":"30/10/2019","lang":"en"},{"name":"VueJS Amsterdam","title":"Nuxt 2019","speaker":"Sébastien Chopin","description":"Sébastien gives an overview of Nuxt in 2019","logo":"https://pbs.twimg.com/profile_images/1042510623962275840/1Iw_Mvud_400x400.jpg","eventLogo":"vuejs_amsterdam.svg","eventLink":"https://vuejs.amsterdam/","link":"https://youtu.be/m0UtuJoigvQ","date":"20/02/2019","lang":"en"},{"name":"Vue Day Alicante 2019","title":"Deep Dive into Nuxt internals","speaker":"Sébastien Chopin","description":"Ever wondered how Nuxt works? Sebastien, creator of Nuxt will explain how the framework works internally. Giving you the knowledge to enjoy the full power of Nuxt and its module ecosystem.","logo":"https://pbs.twimg.com/profile_images/1042510623962275840/1Iw_Mvud_400x400.jpg","eventLogo":"vue_day.svg","eventLink":"https://vueday.org/","link":"https://youtu.be/mxJlUMFC9Ns","date":"14/06/2019","lang":"en"},{"name":"VueConf Toronto","title":"Leave your legacy code behind and go Nuxt","speaker":"Debbie O'Brien","description":"A case study on how Debbie and her team built their client's site, what they used and how they made it as performant as possible and were able to deliver better results to their clients and how now they have left the legacy code behind and have fully gone Nuxt.","logo":"https://pbs.twimg.com/profile_images/1252900852156772352/JLIVJ-TC_400x400.jpg","eventLogo":"vueconf_toronto.svg","eventLink":"https://www.vuetoronto.com/","link":"https://youtu.be/FBEOIuDUZh4","date":"20/11/2019","lang":"en"}],"empty":true,"description":"","body":{"raw":"---\nevents:\n  -\n    name: 'ReactiveConf 2019'\n    title: 'Be Lazy, Be Smart, Be Nuxt'\n    speaker: 'Sébastien Chopin'\n    description: 'Sebastien demonstrates how to create a web application quickly by using Nuxt and explaining how it works under the hood. Giving you confidence for your next Vue applications.'\n    logo: 'https://pbs.twimg.com/profile_images/1042510623962275840/1Iw_Mvud_400x400.jpg'\n    eventLogo: 'reactive_conf.svg'\n    eventLink: 'https://reactiveconf.com/'\n    link: 'https://youtu.be/vbsPXHCu8Xg'\n    date: '30/10/2019'\n    lang: 'en'\n  -\n    name: 'VueJS Amsterdam'\n    title: 'Nuxt 2019'\n    speaker: 'Sébastien Chopin'\n    description: 'Sébastien gives an overview of Nuxt in 2019'\n    logo: 'https://pbs.twimg.com/profile_images/1042510623962275840/1Iw_Mvud_400x400.jpg'\n    eventLogo: 'vuejs_amsterdam.svg'\n    eventLink: 'https://vuejs.amsterdam/'\n    link: 'https://youtu.be/m0UtuJoigvQ'\n    date: '20/02/2019'\n    lang: 'en'\n  -\n    name: 'Vue Day Alicante 2019'\n    title: 'Deep Dive into Nuxt internals'\n    speaker: 'Sébastien Chopin'\n    description: 'Ever wondered how Nuxt works? Sebastien, creator of Nuxt will explain how the framework works internally. Giving you the knowledge to enjoy the full power of Nuxt and its module ecosystem.'\n    logo: 'https://pbs.twimg.com/profile_images/1042510623962275840/1Iw_Mvud_400x400.jpg'\n    eventLogo: 'vue_day.svg'\n    eventLink: 'https://vueday.org/'\n    link: 'https://youtu.be/mxJlUMFC9Ns'\n    date: '14/06/2019'\n    lang: 'en'\n  -\n    name: 'VueConf Toronto'\n    title: 'Leave your legacy code behind and go Nuxt'\n    speaker: \"Debbie O'Brien\"\n    description: \"A case study on how Debbie and her team built their client's site, what they used and how they made it as performant as possible and were able to deliver better results to their clients and how now they have left the legacy code behind and have fully gone Nuxt.\"\n    logo: 'https://pbs.twimg.com/profile_images/1252900852156772352/JLIVJ-TC_400x400.jpg'\n    eventLogo: 'vueconf_toronto.svg'\n    eventLink: 'https://www.vuetoronto.com/'\n    link: 'https://youtu.be/FBEOIuDUZh4'\n    date: '20/11/2019'\n    lang: 'en'\n---\n","ast":{"type":"root","children":[]},"toc":{"title":"","searchDepth":2,"depth":2,"links":[]}}}