{"key":"content:en:_collections:navigations:header.md","generatedAt":"2022-04-23T04:29:22.764Z","mtime":"2022-04-23T04:29:22.762Z","slug":"header","title":"Header","position":"999999999999","to":"/collections/navigations/header","draft":false,"page":false,"language":"en","links":[{"title":"Discover","items":[{"title":"Showcases","subtitle":"Selection of websites built with Nuxt","slug":"showcases","to":"/showcases","icon":"showcases.svg","color":"bg-sand"},{"title":"Case studies","subtitle":"How companies use Nuxt","slug":"case-studies","to":"/case-studies","icon":"case-studies.svg","color":"bg-sand-dark"},{"title":"Testimonials","subtitle":"What they think about us","slug":"testimonials","to":"/testimonials","icon":"testimonials.svg","color":"bg-sand-darker"}]},{"title":"Learn","items":[{"title":"Docs","subtitle":"Create fast websites easily","slug":"docs","to":"/docs","icon":"docs.svg","color":"bg-green-500"},{"title":"Examples","subtitle":"Understand everything in Nuxt","slug":"examples","to":"/examples","icon":"examples.svg","color":"bg-green-600"},{"title":"Tutorials","subtitle":"Learn with concrete cases","slug":"tutorials","to":"/tutorials","icon":"tutorials.svg","color":"bg-green-700"},{"title":"Master courses","subtitle":"Learn more with experts","href":"https://masteringnuxt.com/?utm_source=nuxt&utm_medium=link&utm_campaign=nsite","icon":"master-courses.svg","color":"bg-green-800"}]},{"title":"Explore","items":[{"title":"Deployments","subtitle":"How to Deploy Nuxt","slug":"deployments","to":"/deployments","icon":"deployments.svg","color":"bg-indigo-light"},{"title":"Modules","subtitle":"Extend the power of Nuxt","href":"https://modules.nuxtjs.org","icon":"modules.svg","color":"bg-indigo"},{"title":"Themes","subtitle":"Get started with themes","slug":"themes","to":"/themes","icon":"themes.svg","color":"bg-indigo-dark"},{"title":"Video Courses","subtitle":"Learn step by step","slug":"video-courses","to":"/video-courses","icon":"video-courses.svg","color":"bg-indigo-darker"}]},{"title":"Community","items":[{"title":"Announcements","subtitle":"Latest news about Nuxt","slug":"announcements","to":"/announcements","icon":"announcements.svg","color":"bg-mint-lighter"},{"title":"Teams","subtitle":"They are Nuxt","slug":"teams","to":"/teams","icon":"teams.svg","color":"bg-mint-light"},{"title":"Releases","subtitle":"All the code we have released","slug":"releases","to":"/releases","icon":"releases.svg","color":"bg-mint"},{"title":"Sponsors","subtitle":"They trust us","slug":"sponsors","to":"/sponsors","icon":"sponsors.svg","color":"bg-mint-dark"}]},{"title":"Partners","slug":"partners","to":"/partners"}],"empty":true,"description":"","body":{"raw":"---\nlinks:\n  - title: 'Discover'\n    items:\n      - title: 'Showcases'\n        subtitle: 'Selection of websites built with Nuxt'\n        slug: 'showcases'\n        to: '/showcases'\n        icon: 'showcases.svg'\n        color: 'bg-sand'\n      - title: 'Case studies'\n        subtitle: 'How companies use Nuxt'\n        slug: 'case-studies'\n        to: '/case-studies'\n        icon: 'case-studies.svg'\n        color: 'bg-sand-dark'\n      - title: 'Testimonials'\n        subtitle: 'What they think about us'\n        slug: 'testimonials'\n        to: '/testimonials'\n        icon: 'testimonials.svg'\n        color: 'bg-sand-darker'\n  - title: 'Learn'\n    items:\n      - title: 'Docs'\n        subtitle: 'Create fast websites easily'\n        slug: 'docs'\n        to: '/docs'\n        icon: 'docs.svg'\n        color: 'bg-green-500'\n\n      - title: 'Examples'\n        subtitle: 'Understand everything in Nuxt'\n        slug: 'examples'\n        to: '/examples'\n        icon: 'examples.svg'\n        color: 'bg-green-600'\n      - title: 'Tutorials'\n        subtitle: 'Learn with concrete cases'\n        slug: 'tutorials'\n        to: '/tutorials'\n        icon: 'tutorials.svg'\n        color: 'bg-green-700'\n      - title: 'Master courses'\n        subtitle: 'Learn more with experts'\n        href: 'https://masteringnuxt.com/?utm_source=nuxt&utm_medium=link&utm_campaign=nsite'\n        icon: 'master-courses.svg'\n        color: 'bg-green-800'\n  - title: 'Explore'\n    items:\n      - title: 'Deployments'\n        subtitle: 'How to Deploy Nuxt'\n        slug: 'deployments'\n        to: '/deployments'\n        icon: 'deployments.svg'\n        color: 'bg-indigo-light'\n      - title: 'Modules'\n        subtitle: 'Extend the power of Nuxt'\n        href: 'https://modules.nuxtjs.org'\n        icon: 'modules.svg'\n        color: 'bg-indigo'\n      - title: 'Themes'\n        subtitle: 'Get started with themes'\n        slug: 'themes'\n        to: '/themes'\n        icon: 'themes.svg'\n        color: 'bg-indigo-dark'\n      - title: 'Video Courses'\n        subtitle: 'Learn step by step'\n        slug: 'video-courses'\n        to: '/video-courses'\n        icon: 'video-courses.svg'\n        color: 'bg-indigo-darker'\n  - title: 'Community'\n    items:\n      - title: 'Announcements'\n        subtitle: 'Latest news about Nuxt'\n        slug: 'announcements'\n        to: '/announcements'\n        icon: 'announcements.svg'\n        color: 'bg-mint-lighter'\n      - title: 'Teams'\n        subtitle: 'They are Nuxt'\n        slug: 'teams'\n        to: '/teams'\n        icon: 'teams.svg'\n        color: 'bg-mint-light'\n      - title: 'Releases'\n        subtitle: 'All the code we have released'\n        slug: 'releases'\n        to: '/releases'\n        icon: 'releases.svg'\n        color: 'bg-mint'\n      - title: 'Sponsors'\n        subtitle: 'They trust us'\n        slug: 'sponsors'\n        to: '/sponsors'\n        icon: 'sponsors.svg'\n        color: 'bg-mint-dark'\n  - title: 'Partners'\n    slug: 'partners'\n    to: '/partners'\n---\n","ast":{"type":"root","children":[]},"toc":{"title":"","searchDepth":2,"depth":2,"links":[]}}}