{"key":"content:zh:_collections:events:2021.md","generatedAt":"2022-04-22T15:48:28.592Z","mtime":"2022-04-22T15:48:28.592Z","slug":"2021","title":"2021","position":"999999999999","to":"/collections/events/2021","draft":false,"page":false,"language":"zh","events":[{"name":"Vuejs Amsterdam","title":"Nuxt3 in Action","speaker":"Sébastien Chopin","description":"Get a first glance at what Nuxt3 looks like from a user perspective with this demo from Sébastien","logo":"https://pbs.twimg.com/profile_images/1042510623962275840/1Iw_Mvud_400x400.jpg","eventLogo":"vuejs_amsterdam.svg","eventLink":"https://vuejs.amsterdam/","link":"https://youtu.be/ClF9BvKCVwY","date":"26/02/2021","lang":"English"},{"name":"Vuejs Amsterdam","title":"State of Nuxt3","speaker":"Pooya Parsa","description":"In this talk, Pooya recaps how Nuxt works, and gives details about what Nuxt3 brings to the table, including Nitro, Nuxt Kit and the new CLI.","logo":"https://pbs.twimg.com/profile_images/1268227177612541952/9-fujxqt_400x400.jpg","eventLogo":"vuejs_amsterdam.svg","eventLink":"https://vuejs.amsterdam/","link":"https://youtu.be/_-wqph-IaAw","date":"26/02/2021","lang":"English"},{"name":"Vuejs Amsterdam","title":"Edge-rendering with Nuxt","speaker":"Daniel Roe","description":"Take a sneak peek at the next-generation rendering engine that will power Nuxt 3 and Nuxt 2. Look at how this revolutionises building SSR Vue apps, and what you need to do to use this today.","logo":"https://pbs.twimg.com/profile_images/1326211963614007302/UJyvtK2f_400x400.jpg","eventLogo":"vuejs_amsterdam.svg","eventLink":"https://vuejs.amsterdam/","link":"https://youtu.be/ApUPE8b-m04","date":"26/02/2021","lang":"English"},{"name":"Strapi Conf","title":"Nuxt + Strapi + Composition API","speaker":"Alexander Lichter","description":"In this session, Alexander builds the fitting frontend for a Strapi CMS backend by leveraging the Composition API and ensure it is performant and fast. Get insights into the world of Vue and Nuxt, useful patterns for the Composition API and possibly some sneak peaks","logo":"https://pbs.twimg.com/profile_images/1316077440414998528/mY2rcM7__400x400.jpg","eventLogo":"strapi.jpeg","imgUrl":"/img/events/light/strapi-conf-alexander-lichter.png","eventLink":"https://conf.strapi.io/","link":"https://youtu.be/WZI5lt607ww","date":"06/05/2021","lang":"English"}],"empty":true,"description":"","body":{"raw":"---\nevents:\n  -\n    name: 'Vuejs Amsterdam'\n    title: 'Nuxt3 in Action'\n    speaker: 'Sébastien Chopin'\n    description: 'Get a first glance at what Nuxt3 looks like from a user perspective with this demo from Sébastien'\n    logo: 'https://pbs.twimg.com/profile_images/1042510623962275840/1Iw_Mvud_400x400.jpg'\n    eventLogo: 'vuejs_amsterdam.svg'\n    eventLink: 'https://vuejs.amsterdam/'\n    link: 'https://youtu.be/ClF9BvKCVwY'\n    date: '26/02/2021'\n    lang: 'English'\n  -\n    name: 'Vuejs Amsterdam'\n    title: 'State of Nuxt3'\n    speaker: 'Pooya Parsa'\n    description: 'In this talk, Pooya recaps how Nuxt works, and gives details about what Nuxt3 brings to the table, including Nitro, Nuxt Kit and the new CLI.'\n    logo: 'https://pbs.twimg.com/profile_images/1268227177612541952/9-fujxqt_400x400.jpg'\n    eventLogo: 'vuejs_amsterdam.svg'\n    eventLink: 'https://vuejs.amsterdam/'\n    link: 'https://youtu.be/_-wqph-IaAw'\n    date: '26/02/2021'\n    lang: 'English'\n  -\n    name: 'Vuejs Amsterdam'\n    title: 'Edge-rendering with Nuxt'\n    speaker: 'Daniel Roe'\n    description: 'Take a sneak peek at the next-generation rendering engine that will power Nuxt 3 and Nuxt 2. Look at how this revolutionises building SSR Vue apps, and what you need to do to use this today.'\n    logo: 'https://pbs.twimg.com/profile_images/1326211963614007302/UJyvtK2f_400x400.jpg'\n    eventLogo: 'vuejs_amsterdam.svg'\n    eventLink: 'https://vuejs.amsterdam/'\n    link: 'https://youtu.be/ApUPE8b-m04'\n    date: '26/02/2021'\n    lang: 'English'\n  -\n    name: 'Strapi Conf'\n    title: 'Nuxt + Strapi + Composition API'\n    speaker: 'Alexander Lichter'\n    description: 'In this session, Alexander builds the fitting frontend for a Strapi CMS backend by leveraging the Composition API and ensure it is performant and fast. Get insights into the world of Vue and Nuxt, useful patterns for the Composition API and possibly some sneak peaks'\n    logo: 'https://pbs.twimg.com/profile_images/1316077440414998528/mY2rcM7__400x400.jpg'\n    eventLogo: 'strapi.jpeg'\n    imgUrl: '/img/events/light/strapi-conf-alexander-lichter.png'\n    eventLink: 'https://conf.strapi.io/'\n    link: 'https://youtu.be/WZI5lt607ww'\n    date: '06/05/2021'\n    lang: 'English'\n---\n","ast":{"type":"root","children":[]},"toc":{"title":"","searchDepth":2,"depth":2,"links":[]}}}