{"key":"content:_collections:partners:technology:4.swell.md","generatedAt":"2022-04-23T01:43:25.576Z","mtime":"2022-04-23T01:43:25.575Z","slug":"swell","title":"Swell","position":"999999999999","to":"/collections/partners/technology/swell","draft":false,"page":false,"language":"en","description":"Swell gives developers, agencies, and brands the ability to sell whatever and however they want, with all the benefits of a managed SaaS platform.","logo":"/img/companies/square/dark/swell.svg","logoFull":"/img/companies/full/dark/swell.svg","link":"https://www.swell.is/?ref=nuxt","icon":"swell.svg","fullDescription":"Future-proof your business with headless ecommerce. Get started fast with APIs, storefronts, and an intuitive dashboard. Whatever your business model or shopping experience—Swell is ready to grow with you.","services":["CMS","Ecommerce"],"resources":[{"name":"Discover Swell features","url":"https://www.swell.is/features"}],"emailAddress":null,"phoneNumber":null,"twitter":"swellcommerce","github":"swellstores","color":["#57349a"],"empty":true,"body":{"raw":"---\ntitle: Swell\ndescription: \"Swell gives developers, agencies, and brands the ability to sell whatever and however they want, with all the benefits of a managed SaaS platform.\"\nlogo: /img/companies/square/dark/swell.svg\nlogoFull: /img/companies/full/dark/swell.svg\nlink: https://www.swell.is/?ref=nuxt\nicon: swell.svg\nfullDescription: \"Future-proof your business with headless ecommerce. Get started fast with APIs, storefronts, and an intuitive dashboard. Whatever your business model or shopping experience—Swell is ready to grow with you.\"\nservices:\n  - CMS\n  - Ecommerce\nresources:\n  -\n    name: 'Discover Swell features'\n    url: 'https://www.swell.is/features'\nemailAddress:\nphoneNumber:\ntwitter: 'swellcommerce'\ngithub: 'swellstores'\ncolor:\n  - '#57349a'\n---\n","ast":{"type":"root","children":[]},"toc":{"title":"","searchDepth":2,"depth":2,"links":[]}}}