{"key":"content:_collections:partners:technology:6.strapi.md","generatedAt":"2022-04-21T12:09:56.375Z","mtime":"2022-04-21T12:09:56.375Z","slug":"strapi","title":"Strapi","position":"999999999999","to":"/collections/partners/technology/strapi","draft":false,"page":false,"language":"en","description":"Strapi is the leading open-source headless CMS. It’s 100% JavaScript, fully customizable and developer-first.","logo":{"light":"/img/companies/square/light/strapi.svg","dark":"/img/companies/square/dark/strapi.svg"},"logoFull":"/img/companies/full/dark/strapi.svg","link":"https://strapi.io/?ref=nuxt","icon":"strapi.svg","fullDescription":"Strapi is the leading open-source Headless CMS. Strapi gives developers the freedom to use their favorite tools and frameworks while allowing editors to easily manage their content and distribute it anywhere.","services":["CMS","Open Source"],"resources":[{"name":"Get started with Strapi and Nuxt","url":"https://strapi.io/integrations/nuxtjs-cms"},{"name":"@nuxtjs/strapi","url":"https://strapi.nuxtjs.org"}],"emailAddress":null,"phoneNumber":null,"twitter":"strapijs","github":"strapi","color":["#8c4bff"],"empty":true,"body":{"raw":"---\ntitle: Strapi\ndescription: \"Strapi is the leading open-source headless CMS. It’s 100% JavaScript, fully customizable and developer-first.\"\nlogo: \n  light: /img/companies/square/light/strapi.svg\n  dark: /img/companies/square/dark/strapi.svg\nlogoFull: /img/companies/full/dark/strapi.svg\nlink: https://strapi.io/?ref=nuxt\nicon: strapi.svg\nfullDescription: \"Strapi is the leading open-source Headless CMS. Strapi gives developers the freedom to use their favorite tools and frameworks while allowing editors to easily manage their content and distribute it anywhere.\"\nservices:\n  - CMS\n  - Open Source\nresources:\n  -\n    name: 'Get started with Strapi and Nuxt'\n    url: 'https://strapi.io/integrations/nuxtjs-cms'\n  -\n    name: '@nuxtjs/strapi'\n    url: 'https://strapi.nuxtjs.org'\nemailAddress:\nphoneNumber:\ntwitter: 'strapijs'\ngithub: 'strapi'\ncolor:\n  - '#8c4bff'\n---\n","ast":{"type":"root","children":[]},"toc":{"title":"","searchDepth":2,"depth":2,"links":[]}}}