{"key":"content:_collections:partners:agency:5.webreinvent.md","generatedAt":"2022-04-21T13:49:01.028Z","mtime":"2022-04-21T13:49:01.027Z","slug":"webreinvent","title":"WebReinvent","position":"999999999999","to":"/collections/partners/agency/webreinvent","draft":false,"page":false,"language":"en","description":"WebReinvent is a software development company and we have delivered MVP to enterprise-level web applications from startup to MSME. We have also developed blazing-fast frontends, API, and multi-tenant SaaS applications.","logo":{"light":"/img/companies/square/light/webreinvent.svg","dark":"/img/companies/square/dark/webreinvent.svg"},"logoFull":"/img/companies/full/light/webreinvent.svg","link":"https://webreinvent.com/?utm_source=nuxt&utm_medium=nuxtjs.org&utm_campaign=partner","icon":"webreinvent.svg","fullDescription":"WebReinvent has 10+ years of experience in building software and a team of 35 software professionals including frontend developers, software developers, UI/UX designers, testers, project managers, etc.\n\nWe have been developing blazing-fast frontends using NuxtJS with 5+ years of experience and the team is well versed with the NuxtJs modules and the entire ecosystem. We are one of the most process-driven companies and we love to follow industry standards. Some of them are managing git repo, code review, release deployments via CI/CD, automated software testing, maintaining detailed technical documentation, application performance monitoring, etc.\n\nWe have been delivering MVP to enterprise-level software products from startup to MSME. We have also developed & deployed large-scale API and multi-tenant SaaS applications. \n\nWe would love to chat and learn more about your dream project.","services":["Nuxt Development","API Integrations","SaaS Development","Laravel Development","Mobile Apps"],"resources":[{"name":"Our Open Source projects","url":"https://vaah.dev/?ref=nuxt"}],"emailAddress":"we@webreinvent.com","phoneNumber":null,"github":"webreinvent","twitter":"weinvent","linkedin":"webreinvent","color":["#5f4ca4"],"location":"New Dehli, IND - Louisville, KY","empty":true,"body":{"raw":"---\ntitle: \"WebReinvent\"\ndescription: \"WebReinvent is a software development company and we have delivered MVP to enterprise-level web applications from startup to MSME. We have also developed blazing-fast frontends, API, and multi-tenant SaaS applications.\"\nlogo: \n  light: \"/img/companies/square/light/webreinvent.svg\"\n  dark: \"/img/companies/square/dark/webreinvent.svg\"\nlogoFull: \"/img/companies/full/light/webreinvent.svg\"\nlink: https://webreinvent.com/?utm_source=nuxt&utm_medium=nuxtjs.org&utm_campaign=partner \nicon: webreinvent.svg\nfullDescription: \"WebReinvent has 10+ years of experience in building software and a team of 35 software professionals including frontend developers, software developers, UI/UX designers, testers, project managers, etc.\n\n\nWe have been developing blazing-fast frontends using NuxtJS with 5+ years of experience and the team is well versed with the NuxtJs modules and the entire ecosystem. We are one of the most process-driven companies and we love to follow industry standards. Some of them are managing git repo, code review, release deployments via CI/CD, automated software testing, maintaining detailed technical documentation, application performance monitoring, etc.\n\n\nWe have been delivering MVP to enterprise-level software products from startup to MSME. We have also developed & deployed large-scale API and multi-tenant SaaS applications. \n\n\nWe would love to chat and learn more about your dream project.\"\nservices:\n  - Nuxt Development\n  - API Integrations\n  - SaaS Development\n  - Laravel Development\n  - Mobile Apps\nresources:\n  -\n    name: 'Our Open Source projects'\n    url: 'https://vaah.dev/?ref=nuxt'\nemailAddress: we@webreinvent.com\nphoneNumber:\ngithub: 'webreinvent'\ntwitter: 'weinvent'\nlinkedin: 'webreinvent'\ncolor:\n  - '#5f4ca4'\nlocation: New Dehli, IND - Louisville, KY\n---\n","ast":{"type":"root","children":[]},"toc":{"title":"","searchDepth":2,"depth":2,"links":[]}}}