{"key":"content:_collections:partners:agency:0.ship-shape.md","generatedAt":"2022-04-22T12:51:43.042Z","mtime":"2022-04-22T12:51:43.039Z","slug":"ship-shape","title":"Ship Shape","position":"999999999999","to":"/collections/partners/agency/ship-shape","draft":false,"page":false,"language":"en","description":"Ship Shape leads the future of full-stack web app development. Our clients work with us because they are a one-stop boutique firm with over 25+ years combined experience - from full-stack engineering, to front-end to back-end design and more.","logo":{"light":"/img/companies/square/light/shipshape.webp","dark":"/img/companies/square/dark/shipshape.webp"},"logoFull":"/img/companies/full/light/shipshape.png","link":"https://shipshape.io/?ref=nuxt","icon":"shipshape.webp","fullDescription":"Ship Shape leads the future of full-stack web app development. Our clients work with us because we are a one-stop boutique firm with over 25+ years combined experience - from full-stack engineering, to front-end to back-end design and more. When you bring your idea to us, it's smooth sailing.","services":["Development & integration","Mobile Apps","Nuxt consulting"],"resources":[{"name":"Discover Ship Shape services","url":"https://shipshape.io/services/"}],"emailAddress":null,"phoneNumber":null,"twitter":"shipshapecode","github":"shipshapecode","color":["#ed6a5e"],"location":"Middleburg, VA","empty":true,"body":{"raw":"---\ntitle: \"Ship Shape\"\ndescription: \"Ship Shape leads the future of full-stack web app development. Our clients work with us because they are a one-stop boutique firm with over 25+ years combined experience - from full-stack engineering, to front-end to back-end design and more.\"\nlogo: \n  light: \"/img/companies/square/light/shipshape.webp\"\n  dark: \"/img/companies/square/dark/shipshape.webp\"\nlogoFull: \"/img/companies/full/light/shipshape.png\"\nlink: https://shipshape.io/?ref=nuxt\nicon: shipshape.webp\nfullDescription: \"Ship Shape leads the future of full-stack web app development. Our clients work with us because we are a one-stop boutique firm with over 25+ years combined experience - from full-stack engineering, to front-end to back-end design and more. When you bring your idea to us, it's smooth sailing.\"\nservices:\n  - Development & integration\n  - Mobile Apps\n  - Nuxt consulting\nresources:\n  -\n    name: 'Discover Ship Shape services'\n    url: 'https://shipshape.io/services/'\nemailAddress:\nphoneNumber:\ntwitter: 'shipshapecode'\ngithub: 'shipshapecode'\ncolor:\n  - '#ed6a5e'\nlocation: Middleburg, VA\n---\n","ast":{"type":"root","children":[]},"toc":{"title":"","searchDepth":2,"depth":2,"links":[]}}}