{"key":"content:zh:deployments:azure-static-web-apps.md","generatedAt":"2022-04-21T12:09:59.445Z","mtime":"2022-04-21T12:09:59.423Z","slug":"azure-static-web-apps","title":"Azure Static Web Apps","position":"999999990000","to":"/deployments/azure-static-web-apps","draft":false,"page":true,"language":"zh","template":"guide","description":"How to deploy a Nuxt application on Azure Static Web Apps?","target":"Static","category":"deployment","logo":{"light":"/img/companies/square/light/Azure.svg","dark":"/img/companies/square/dark/Azure.svg"},"empty":false,"body":{"raw":"---\ntemplate: guide\ntitle: Azure Static Web Apps\ndescription: How to deploy a Nuxt application on Azure Static Web Apps?\ntarget: Static\ncategory: deployment\nlogo:\n  light: \"/img/companies/square/light/Azure.svg\"\n  dark: \"/img/companies/square/dark/Azure.svg\"\n---\n# Deploy on Azure Static Web Apps\n\nHow to deploy a Nuxt application on Azure Static Web Apps?\n\n---\n\nYou can now deploy your static sites to Azure using Azure static web apps. You will need to have your app in GitHub as Azure static web apps leverages GitHub actions which allow you to re-build your static site on every git push.\n\nThere are 2 things you need to configure in order to deploy your app to Azure static web apps. The first one is to modify the build command as Azure reads the build command from your package.json and for static sites we need to use the generate command.\n\n`package.json`\n\n```json\nbuild: \"nuxt generate\"\n```\n\nThe second one is to add a routes.json file which is important for catching custom 404 pages and spa fallback pages.\n\n`static/routes.json`\n\n```jsx\n{\n \"routes\": [],\n \"platformErrorOverrides\": [\n   {\n    \"errorType\": \"NotFound\",\n    \"serve\": \"/200.html\",\n    \"statusCode\": 200\n   }\n ]\n}\n```\n\nIf you want to test out deploying to Azure static web apps, we have created a small demo application that is all setup and configured. You will just need to clone it and add it to your GitHub repo. You can then follow the steps on - Deploying your app with Azure Static Web Apps.\n\n[Clone the demo app](https://github.com/debs-obrien/nuxtjs-azure-static-app)\n\n## Deploying your app with Azure Static Web Apps\n\n### Step 1: **Create Azure static web apps**\n\n1. Navigate to the [Azure Portal](https://portal.azure.com/).\n2. Click **Create a Resource** then search for **Static App** and select it.\n3. Select a subscription from the *Subscription* drop-down list or use the default one.\n4. Click the **New** link below the *Resource group* dropdown. In *New resource group name*, type **nuxt** and click **OK**\n5. Provide a globally unique name for your app in the **Name** text box. Valid characters include `a-z`, `A-Z`, `0-9`, and `-`. The app name is used to identify the app in your list of resources therefore it is a good idea to name your app using the name of your repository.\n6. In the *Region* dropdown, choose a region closest to you.\n\n![Azure Portal resource and app setup](https://user-images.githubusercontent.com/13063165/82118135-71891b00-9775-11ea-8284-aa94d17a3bc3.png)\n\n### Step 2: **Add a GitHub repository**\n\nAzure App Service Static App needs access to the repository where your Nuxt app lives so it can automatically deploy commits:\n\n1. Click the **Sign in with GitHub button**\n2. Select the **Organization** under which you created the repo for your Nuxt project. It can also be your GitHub username.\n3. Find the name of the repository you created earlier and select it.\n4. Choose **master** as the branch from the *Branch* dropdown.\n\n![how to add github](https://user-images.githubusercontent.com/13063165/82118359-38ea4100-9777-11ea-9c5e-7ba5c4da708e.png)\n\n### Step 3: **Configure the build process**\n\nThere are few things that Azure App Service Static App can assume - things like automatically installing npm modules and running `npm run build`. There are also few you have to be explicit about, like what folder will the static app be copied to after build so the static site can be served from there.\n\n1. Click on the **Build** tab to configure the static output folder.\n2. Type **dist** in the *App artifact location* text box.\n\n![Azure portal configure build](https://user-images.githubusercontent.com/13063165/82118277-71d5e600-9776-11ea-88ad-48cf0793905d.png)\n\n### Step 4: **Review and create**\n\n1. Click the **Review + Create** button to verify the details are all correct.\n2. Click **Create** to start the creation of the resource and also provision a GitHub Action for deployment.\n3. Once the deployment is completed, click **Go to resource**\n\n![azure portal deployment complete message](https://user-images.githubusercontent.com/13063165/82118390-67681c00-9777-11ea-9778-671dc768393e.png)\n\n4. On the resource screen, click the *URL* link to open your deployed application.\n\n![resource screen with url to your deployed app](https://user-images.githubusercontent.com/13063165/82118042-d001c980-9774-11ea-94f5-57d995aa5391.png)\n\nCongrats your static site is now hosted on Azure static web apps.\n\n## Rebuild your static app and monitoring deployment\n\nNow all you have to do is modify your code and push your changes. Pushing your changes will activate a GitHub action and your new site will automatically rebuild. You can monitor the workflow by clicking on the actions tab in your GitHub repo and you can inspect even further by selecting the last commit you made. You can then watch to see when the deploy is finished or inspect the log if you have any deployment errors.\n\n![GitHub actions screen](https://user-images.githubusercontent.com/13063165/82118249-34715880-9776-11ea-92e2-dbd21bbf7cb6.png)\n\n## Did you know?\n\n### **How to handle dynamic routes**\n\nIf you are working with dynamic pages such as `_id.vue` then you you will need to add these routes to the generate property in your nuxt config.\n\n[See the documentation on how to handle dynamic routes.](/docs/configuration-glossary/configuration-generate#routes)\n\n<div class=\"Alert\">\nIf you are using Nuxt 2.13+ then you won't have to worry about this as there is a built in crawler which will crawl all dynamics by crawling the links in your site.\n</div>\n\n### How to add an error page\n\nIn order to not have the default 404 page you can create an `error.vue` file in your layouts folder.\n\n### How to add SPA fallback\n\nIf you would like some pages to not be generated but act as a single page application you can do so using the generate.excludes property in your nuxt.config file.\n\n[See the documentation on spa fallback](/docs/configuration-glossary/configuration-generate#exclude)\n","ast":{"type":"root","children":[{"type":"element","tag":"prose-h1","props":{"class":"d-heading-title","id":"deploy-on-azure-static-web-apps"},"children":[{"type":"text","value":"Deploy on Azure Static Web Apps"}]},{"type":"text","value":"\n"},{"type":"element","tag":"prose-paragraph","props":{"class":"d-heading-description"},"children":[{"type":"text","value":"How to deploy a Nuxt application on Azure Static Web Apps?"}]},{"type":"text","value":"\n"},{"type":"element","tag":"prose-hr","props":{"class":"d-heading-hr"},"children":[]},{"type":"text","value":"\n"},{"type":"element","tag":"prose-paragraph","props":{},"children":[{"type":"text","value":"You can now deploy your static sites to Azure using Azure static web apps. You will need to have your app in GitHub as Azure static web apps leverages GitHub actions which allow you to re-build your static site on every git push."}]},{"type":"text","value":"\n"},{"type":"element","tag":"prose-paragraph","props":{},"children":[{"type":"text","value":"There are 2 things you need to configure in order to deploy your app to Azure static web apps. The first one is to modify the build command as Azure reads the build command from your package.json and for static sites we need to use the generate command."}]},{"type":"text","value":"\n"},{"type":"element","tag":"prose-paragraph","props":{},"children":[{"type":"element","tag":"prose-code-inline","props":{},"children":[{"type":"text","value":"package.json"}]}]},{"type":"text","value":"\n"},{"type":"element","tag":"prose-code","props":{},"children":[{"type":"element","tag":"pre","props":{"className":["line-numbers","language-json"]},"children":[{"type":"element","tag":"code","props":{},"children":[{"type":"text","value":"build"},{"type":"element","tag":"span","props":{"className":["token","operator"]},"children":[{"type":"text","value":":"}]},{"type":"text","value":" "},{"type":"element","tag":"span","props":{"className":["token","string"]},"children":[{"type":"text","value":"\"nuxt generate\""}]},{"type":"text","value":"\n"}]}]}]},{"type":"text","value":"\n"},{"type":"element","tag":"prose-paragraph","props":{},"children":[{"type":"text","value":"The second one is to add a routes.json file which is important for catching custom 404 pages and spa fallback pages."}]},{"type":"text","value":"\n"},{"type":"element","tag":"prose-paragraph","props":{},"children":[{"type":"element","tag":"prose-code-inline","props":{},"children":[{"type":"text","value":"static/routes.json"}]}]},{"type":"text","value":"\n"},{"type":"element","tag":"prose-code","props":{},"children":[{"type":"element","tag":"pre","props":{"className":["line-numbers","language-jsx"]},"children":[{"type":"element","tag":"code","props":{},"children":[{"type":"element","tag":"span","props":{"className":["token","punctuation"]},"children":[{"type":"text","value":"{"}]},{"type":"text","value":"\n "},{"type":"element","tag":"span","props":{"className":["token","string-property","property"]},"children":[{"type":"text","value":"\"routes\""}]},{"type":"element","tag":"span","props":{"className":["token","operator"]},"children":[{"type":"text","value":":"}]},{"type":"text","value":" "},{"type":"element","tag":"span","props":{"className":["token","punctuation"]},"children":[{"type":"text","value":"["}]},{"type":"element","tag":"span","props":{"className":["token","punctuation"]},"children":[{"type":"text","value":"]"}]},{"type":"element","tag":"span","props":{"className":["token","punctuation"]},"children":[{"type":"text","value":","}]},{"type":"text","value":"\n "},{"type":"element","tag":"span","props":{"className":["token","string-property","property"]},"children":[{"type":"text","value":"\"platformErrorOverrides\""}]},{"type":"element","tag":"span","props":{"className":["token","operator"]},"children":[{"type":"text","value":":"}]},{"type":"text","value":" "},{"type":"element","tag":"span","props":{"className":["token","punctuation"]},"children":[{"type":"text","value":"["}]},{"type":"text","value":"\n   "},{"type":"element","tag":"span","props":{"className":["token","punctuation"]},"children":[{"type":"text","value":"{"}]},{"type":"text","value":"\n    "},{"type":"element","tag":"span","props":{"className":["token","string-property","property"]},"children":[{"type":"text","value":"\"errorType\""}]},{"type":"element","tag":"span","props":{"className":["token","operator"]},"children":[{"type":"text","value":":"}]},{"type":"text","value":" "},{"type":"element","tag":"span","props":{"className":["token","string"]},"children":[{"type":"text","value":"\"NotFound\""}]},{"type":"element","tag":"span","props":{"className":["token","punctuation"]},"children":[{"type":"text","value":","}]},{"type":"text","value":"\n    "},{"type":"element","tag":"span","props":{"className":["token","string-property","property"]},"children":[{"type":"text","value":"\"serve\""}]},{"type":"element","tag":"span","props":{"className":["token","operator"]},"children":[{"type":"text","value":":"}]},{"type":"text","value":" "},{"type":"element","tag":"span","props":{"className":["token","string"]},"children":[{"type":"text","value":"\"/200.html\""}]},{"type":"element","tag":"span","props":{"className":["token","punctuation"]},"children":[{"type":"text","value":","}]},{"type":"text","value":"\n    "},{"type":"element","tag":"span","props":{"className":["token","string-property","property"]},"children":[{"type":"text","value":"\"statusCode\""}]},{"type":"element","tag":"span","props":{"className":["token","operator"]},"children":[{"type":"text","value":":"}]},{"type":"text","value":" "},{"type":"element","tag":"span","props":{"className":["token","number"]},"children":[{"type":"text","value":"200"}]},{"type":"text","value":"\n   "},{"type":"element","tag":"span","props":{"className":["token","punctuation"]},"children":[{"type":"text","value":"}"}]},{"type":"text","value":"\n "},{"type":"element","tag":"span","props":{"className":["token","punctuation"]},"children":[{"type":"text","value":"]"}]},{"type":"text","value":"\n"},{"type":"element","tag":"span","props":{"className":["token","punctuation"]},"children":[{"type":"text","value":"}"}]},{"type":"text","value":"\n"}]}]}]},{"type":"text","value":"\n"},{"type":"element","tag":"prose-paragraph","props":{},"children":[{"type":"text","value":"If you want to test out deploying to Azure static web apps, we have created a small demo application that is all setup and configured. You will just need to clone it and add it to your GitHub repo. You can then follow the steps on - Deploying your app with Azure Static Web Apps."}]},{"type":"text","value":"\n"},{"type":"element","tag":"prose-paragraph","props":{},"children":[{"type":"element","tag":"prose-a","props":{"href":"https://github.com/debs-obrien/nuxtjs-azure-static-app","rel":["nofollow","noopener","noreferrer"],"target":"_blank"},"children":[{"type":"text","value":"Clone the demo app"}]}]},{"type":"text","value":"\n"},{"type":"element","tag":"prose-h2","props":{"id":"deploying-your-app-with-azure-static-web-apps"},"children":[{"type":"element","tag":"prose-a","props":{"href":"#deploying-your-app-with-azure-static-web-apps"},"children":[{"type":"text","value":"Deploying your app with Azure Static Web Apps"}]}]},{"type":"text","value":"\n"},{"type":"element","tag":"prose-h3","props":{"id":"step-1-create-azure-static-web-apps"},"children":[{"type":"element","tag":"prose-a","props":{"href":"#step-1-create-azure-static-web-apps"},"children":[{"type":"text","value":"Step 1: "},{"type":"element","tag":"prose-strong","props":{},"children":[{"type":"text","value":"Create Azure static web apps"}]}]}]},{"type":"text","value":"\n"},{"type":"element","tag":"prose-ol","props":{},"children":[{"type":"text","value":"\n"},{"type":"element","tag":"prose-li","props":{},"children":[{"type":"text","value":"\n"},{"type":"text","value":"Navigate to the "},{"type":"element","tag":"prose-a","props":{"href":"https://portal.azure.com/","rel":["nofollow","noopener","noreferrer"],"target":"_blank"},"children":[{"type":"text","value":"Azure Portal"}]},{"type":"text","value":"."},{"type":"text","value":"\n"}]},{"type":"text","value":"\n"},{"type":"element","tag":"prose-li","props":{},"children":[{"type":"text","value":"\n"},{"type":"text","value":"Click "},{"type":"element","tag":"prose-strong","props":{},"children":[{"type":"text","value":"Create a Resource"}]},{"type":"text","value":" then search for "},{"type":"element","tag":"prose-strong","props":{},"children":[{"type":"text","value":"Static App"}]},{"type":"text","value":" and select it."},{"type":"text","value":"\n"}]},{"type":"text","value":"\n"},{"type":"element","tag":"prose-li","props":{},"children":[{"type":"text","value":"\n"},{"type":"text","value":"Select a subscription from the "},{"type":"element","tag":"prose-em","props":{},"children":[{"type":"text","value":"Subscription"}]},{"type":"text","value":" drop-down list or use the default one."},{"type":"text","value":"\n"}]},{"type":"text","value":"\n"},{"type":"element","tag":"prose-li","props":{},"children":[{"type":"text","value":"\n"},{"type":"text","value":"Click the "},{"type":"element","tag":"prose-strong","props":{},"children":[{"type":"text","value":"New"}]},{"type":"text","value":" link below the "},{"type":"element","tag":"prose-em","props":{},"children":[{"type":"text","value":"Resource group"}]},{"type":"text","value":" dropdown. In "},{"type":"element","tag":"prose-em","props":{},"children":[{"type":"text","value":"New resource group name"}]},{"type":"text","value":", type "},{"type":"element","tag":"prose-strong","props":{},"children":[{"type":"text","value":"nuxt"}]},{"type":"text","value":" and click "},{"type":"element","tag":"prose-strong","props":{},"children":[{"type":"text","value":"OK"}]},{"type":"text","value":"\n"}]},{"type":"text","value":"\n"},{"type":"element","tag":"prose-li","props":{},"children":[{"type":"text","value":"\n"},{"type":"text","value":"Provide a globally unique name for your app in the "},{"type":"element","tag":"prose-strong","props":{},"children":[{"type":"text","value":"Name"}]},{"type":"text","value":" text box. Valid characters include "},{"type":"element","tag":"prose-code-inline","props":{},"children":[{"type":"text","value":"a-z"}]},{"type":"text","value":", "},{"type":"element","tag":"prose-code-inline","props":{},"children":[{"type":"text","value":"A-Z"}]},{"type":"text","value":", "},{"type":"element","tag":"prose-code-inline","props":{},"children":[{"type":"text","value":"0-9"}]},{"type":"text","value":", and "},{"type":"element","tag":"prose-code-inline","props":{},"children":[{"type":"text","value":"-"}]},{"type":"text","value":". The app name is used to identify the app in your list of resources therefore it is a good idea to name your app using the name of your repository."},{"type":"text","value":"\n"}]},{"type":"text","value":"\n"},{"type":"element","tag":"prose-li","props":{},"children":[{"type":"text","value":"\n"},{"type":"text","value":"In the "},{"type":"element","tag":"prose-em","props":{},"children":[{"type":"text","value":"Region"}]},{"type":"text","value":" dropdown, choose a region closest to you."},{"type":"text","value":"\n"}]},{"type":"text","value":"\n"}]},{"type":"text","value":"\n"},{"type":"element","tag":"prose-paragraph","props":{},"children":[{"type":"element","tag":"prose-img","props":{"alt":"Azure Portal resource and app setup","src":"https://user-images.githubusercontent.com/13063165/82118135-71891b00-9775-11ea-8284-aa94d17a3bc3.png"},"children":[]}]},{"type":"text","value":"\n"},{"type":"element","tag":"prose-h3","props":{"id":"step-2-add-a-github-repository"},"children":[{"type":"element","tag":"prose-a","props":{"href":"#step-2-add-a-github-repository"},"children":[{"type":"text","value":"Step 2: "},{"type":"element","tag":"prose-strong","props":{},"children":[{"type":"text","value":"Add a GitHub repository"}]}]}]},{"type":"text","value":"\n"},{"type":"element","tag":"prose-paragraph","props":{},"children":[{"type":"text","value":"Azure App Service Static App needs access to the repository where your Nuxt app lives so it can automatically deploy commits:"}]},{"type":"text","value":"\n"},{"type":"element","tag":"prose-ol","props":{},"children":[{"type":"text","value":"\n"},{"type":"element","tag":"prose-li","props":{},"children":[{"type":"text","value":"\n"},{"type":"text","value":"Click the "},{"type":"element","tag":"prose-strong","props":{},"children":[{"type":"text","value":"Sign in with GitHub button"}]},{"type":"text","value":"\n"}]},{"type":"text","value":"\n"},{"type":"element","tag":"prose-li","props":{},"children":[{"type":"text","value":"\n"},{"type":"text","value":"Select the "},{"type":"element","tag":"prose-strong","props":{},"children":[{"type":"text","value":"Organization"}]},{"type":"text","value":" under which you created the repo for your Nuxt project. It can also be your GitHub username."},{"type":"text","value":"\n"}]},{"type":"text","value":"\n"},{"type":"element","tag":"prose-li","props":{},"children":[{"type":"text","value":"\n"},{"type":"text","value":"Find the name of the repository you created earlier and select it."},{"type":"text","value":"\n"}]},{"type":"text","value":"\n"},{"type":"element","tag":"prose-li","props":{},"children":[{"type":"text","value":"\n"},{"type":"text","value":"Choose "},{"type":"element","tag":"prose-strong","props":{},"children":[{"type":"text","value":"master"}]},{"type":"text","value":" as the branch from the "},{"type":"element","tag":"prose-em","props":{},"children":[{"type":"text","value":"Branch"}]},{"type":"text","value":" dropdown."},{"type":"text","value":"\n"}]},{"type":"text","value":"\n"}]},{"type":"text","value":"\n"},{"type":"element","tag":"prose-paragraph","props":{},"children":[{"type":"element","tag":"prose-img","props":{"alt":"how to add github","src":"https://user-images.githubusercontent.com/13063165/82118359-38ea4100-9777-11ea-9c5e-7ba5c4da708e.png"},"children":[]}]},{"type":"text","value":"\n"},{"type":"element","tag":"prose-h3","props":{"id":"step-3-configure-the-build-process"},"children":[{"type":"element","tag":"prose-a","props":{"href":"#step-3-configure-the-build-process"},"children":[{"type":"text","value":"Step 3: "},{"type":"element","tag":"prose-strong","props":{},"children":[{"type":"text","value":"Configure the build process"}]}]}]},{"type":"text","value":"\n"},{"type":"element","tag":"prose-paragraph","props":{},"children":[{"type":"text","value":"There are few things that Azure App Service Static App can assume - things like automatically installing npm modules and running "},{"type":"element","tag":"prose-code-inline","props":{},"children":[{"type":"text","value":"npm run build"}]},{"type":"text","value":". There are also few you have to be explicit about, like what folder will the static app be copied to after build so the static site can be served from there."}]},{"type":"text","value":"\n"},{"type":"element","tag":"prose-ol","props":{},"children":[{"type":"text","value":"\n"},{"type":"element","tag":"prose-li","props":{},"children":[{"type":"text","value":"\n"},{"type":"text","value":"Click on the "},{"type":"element","tag":"prose-strong","props":{},"children":[{"type":"text","value":"Build"}]},{"type":"text","value":" tab to configure the static output folder."},{"type":"text","value":"\n"}]},{"type":"text","value":"\n"},{"type":"element","tag":"prose-li","props":{},"children":[{"type":"text","value":"\n"},{"type":"text","value":"Type "},{"type":"element","tag":"prose-strong","props":{},"children":[{"type":"text","value":"dist"}]},{"type":"text","value":" in the "},{"type":"element","tag":"prose-em","props":{},"children":[{"type":"text","value":"App artifact location"}]},{"type":"text","value":" text box."},{"type":"text","value":"\n"}]},{"type":"text","value":"\n"}]},{"type":"text","value":"\n"},{"type":"element","tag":"prose-paragraph","props":{},"children":[{"type":"element","tag":"prose-img","props":{"alt":"Azure portal configure build","src":"https://user-images.githubusercontent.com/13063165/82118277-71d5e600-9776-11ea-88ad-48cf0793905d.png"},"children":[]}]},{"type":"text","value":"\n"},{"type":"element","tag":"prose-h3","props":{"id":"step-4-review-and-create"},"children":[{"type":"element","tag":"prose-a","props":{"href":"#step-4-review-and-create"},"children":[{"type":"text","value":"Step 4: "},{"type":"element","tag":"prose-strong","props":{},"children":[{"type":"text","value":"Review and create"}]}]}]},{"type":"text","value":"\n"},{"type":"element","tag":"prose-ol","props":{},"children":[{"type":"text","value":"\n"},{"type":"element","tag":"prose-li","props":{},"children":[{"type":"text","value":"\n"},{"type":"text","value":"Click the "},{"type":"element","tag":"prose-strong","props":{},"children":[{"type":"text","value":"Review + Create"}]},{"type":"text","value":" button to verify the details are all correct."},{"type":"text","value":"\n"}]},{"type":"text","value":"\n"},{"type":"element","tag":"prose-li","props":{},"children":[{"type":"text","value":"\n"},{"type":"text","value":"Click "},{"type":"element","tag":"prose-strong","props":{},"children":[{"type":"text","value":"Create"}]},{"type":"text","value":" to start the creation of the resource and also provision a GitHub Action for deployment."},{"type":"text","value":"\n"}]},{"type":"text","value":"\n"},{"type":"element","tag":"prose-li","props":{},"children":[{"type":"text","value":"\n"},{"type":"text","value":"Once the deployment is completed, click "},{"type":"element","tag":"prose-strong","props":{},"children":[{"type":"text","value":"Go to resource"}]},{"type":"text","value":"\n"}]},{"type":"text","value":"\n"}]},{"type":"text","value":"\n"},{"type":"element","tag":"prose-paragraph","props":{},"children":[{"type":"element","tag":"prose-img","props":{"alt":"azure portal deployment complete message","src":"https://user-images.githubusercontent.com/13063165/82118390-67681c00-9777-11ea-9778-671dc768393e.png"},"children":[]}]},{"type":"text","value":"\n"},{"type":"element","tag":"prose-ol","props":{"start":4},"children":[{"type":"text","value":"\n"},{"type":"element","tag":"prose-li","props":{},"children":[{"type":"text","value":"\n"},{"type":"text","value":"On the resource screen, click the "},{"type":"element","tag":"prose-em","props":{},"children":[{"type":"text","value":"URL"}]},{"type":"text","value":" link to open your deployed application."},{"type":"text","value":"\n"}]},{"type":"text","value":"\n"}]},{"type":"text","value":"\n"},{"type":"element","tag":"prose-paragraph","props":{},"children":[{"type":"element","tag":"prose-img","props":{"alt":"resource screen with url to your deployed app","src":"https://user-images.githubusercontent.com/13063165/82118042-d001c980-9774-11ea-94f5-57d995aa5391.png"},"children":[]}]},{"type":"text","value":"\n"},{"type":"element","tag":"prose-paragraph","props":{},"children":[{"type":"text","value":"Congrats your static site is now hosted on Azure static web apps."}]},{"type":"text","value":"\n"},{"type":"element","tag":"prose-h2","props":{"id":"rebuild-your-static-app-and-monitoring-deployment"},"children":[{"type":"element","tag":"prose-a","props":{"href":"#rebuild-your-static-app-and-monitoring-deployment"},"children":[{"type":"text","value":"Rebuild your static app and monitoring deployment"}]}]},{"type":"text","value":"\n"},{"type":"element","tag":"prose-paragraph","props":{},"children":[{"type":"text","value":"Now all you have to do is modify your code and push your changes. Pushing your changes will activate a GitHub action and your new site will automatically rebuild. You can monitor the workflow by clicking on the actions tab in your GitHub repo and you can inspect even further by selecting the last commit you made. You can then watch to see when the deploy is finished or inspect the log if you have any deployment errors."}]},{"type":"text","value":"\n"},{"type":"element","tag":"prose-paragraph","props":{},"children":[{"type":"element","tag":"prose-img","props":{"alt":"GitHub actions screen","src":"https://user-images.githubusercontent.com/13063165/82118249-34715880-9776-11ea-92e2-dbd21bbf7cb6.png"},"children":[]}]},{"type":"text","value":"\n"},{"type":"element","tag":"prose-h2","props":{"id":"did-you-know"},"children":[{"type":"element","tag":"prose-a","props":{"href":"#did-you-know"},"children":[{"type":"text","value":"Did you know?"}]}]},{"type":"text","value":"\n"},{"type":"element","tag":"prose-h3","props":{"id":"how-to-handle-dynamic-routes"},"children":[{"type":"element","tag":"prose-a","props":{"href":"#how-to-handle-dynamic-routes"},"children":[{"type":"element","tag":"prose-strong","props":{},"children":[{"type":"text","value":"How to handle dynamic routes"}]}]}]},{"type":"text","value":"\n"},{"type":"element","tag":"prose-paragraph","props":{},"children":[{"type":"text","value":"If you are working with dynamic pages such as "},{"type":"element","tag":"prose-code-inline","props":{},"children":[{"type":"text","value":"_id.vue"}]},{"type":"text","value":" then you you will need to add these routes to the generate property in your nuxt config."}]},{"type":"text","value":"\n"},{"type":"element","tag":"prose-paragraph","props":{},"children":[{"type":"element","tag":"prose-a","props":{"href":"/docs/configuration-glossary/configuration-generate#routes"},"children":[{"type":"text","value":"See the documentation on how to handle dynamic routes."}]}]},{"type":"text","value":"\n"},{"type":"element","tag":"div","props":{"className":["Alert"]},"children":[{"type":"text","value":"\nIf you are using Nuxt 2.13+ then you won't have to worry about this as there is a built in crawler which will crawl all dynamics by crawling the links in your site.\n"}]},{"type":"text","value":"\n"},{"type":"element","tag":"prose-h3","props":{"id":"how-to-add-an-error-page"},"children":[{"type":"element","tag":"prose-a","props":{"href":"#how-to-add-an-error-page"},"children":[{"type":"text","value":"How to add an error page"}]}]},{"type":"text","value":"\n"},{"type":"element","tag":"prose-paragraph","props":{},"children":[{"type":"text","value":"In order to not have the default 404 page you can create an "},{"type":"element","tag":"prose-code-inline","props":{},"children":[{"type":"text","value":"error.vue"}]},{"type":"text","value":" file in your layouts folder."}]},{"type":"text","value":"\n"},{"type":"element","tag":"prose-h3","props":{"id":"how-to-add-spa-fallback"},"children":[{"type":"element","tag":"prose-a","props":{"href":"#how-to-add-spa-fallback"},"children":[{"type":"text","value":"How to add SPA fallback"}]}]},{"type":"text","value":"\n"},{"type":"element","tag":"prose-paragraph","props":{},"children":[{"type":"text","value":"If you would like some pages to not be generated but act as a single page application you can do so using the generate.excludes property in your nuxt.config file."}]},{"type":"text","value":"\n"},{"type":"element","tag":"prose-paragraph","props":{},"children":[{"type":"element","tag":"prose-a","props":{"href":"/docs/configuration-glossary/configuration-generate#exclude"},"children":[{"type":"text","value":"See the documentation on spa fallback"}]}]}]},"toc":{"title":"","searchDepth":2,"depth":2,"links":[{"id":"deploying-your-app-with-azure-static-web-apps","depth":2,"text":"Deploying your app with Azure Static Web Apps","children":[{"id":"step-1-create-azure-static-web-apps","depth":3,"text":"Step 1: Create Azure static web apps"},{"id":"step-2-add-a-github-repository","depth":3,"text":"Step 2: Add a GitHub repository"},{"id":"step-3-configure-the-build-process","depth":3,"text":"Step 3: Configure the build process"},{"id":"step-4-review-and-create","depth":3,"text":"Step 4: Review and create"}]},{"id":"rebuild-your-static-app-and-monitoring-deployment","depth":2,"text":"Rebuild your static app and monitoring deployment"},{"id":"did-you-know","depth":2,"text":"Did you know?","children":[{"id":"how-to-handle-dynamic-routes","depth":3,"text":"How to handle dynamic routes"},{"id":"how-to-add-an-error-page","depth":3,"text":"How to add an error page"},{"id":"how-to-add-spa-fallback","depth":3,"text":"How to add SPA fallback"}]}]}}}