{"key":"content:_collections:partners:agency:2.passionate-people.md","generatedAt":"2022-04-22T12:51:43.043Z","mtime":"2022-04-22T12:51:43.043Z","slug":"passionate-people","title":"Passionate People","position":"999999999999","to":"/collections/partners/agency/passionate-people","draft":false,"page":false,"language":"en","description":"Passionate People provide you with additional technical capacity to power-up your digital transformation journeys with our teams of first-class engineers and consultants. Full stack JavaScript Cloud Engineers ready to work with you and your teams.","logo":"/img/companies/square/dark/passionate-people.jpeg","logoFull":"/img/companies/full/light/passionate-people.webp","link":"https://passionatepeople.io/?ref=nuxt","icon":"passionate-people.jpeg","fullDescription":"Passionate People provide you with additional technical capacity to power-up your digital transformation journeys with our teams of first-class engineers and consultants. Full stack JavaScript Cloud Engineers ready to work with you and your teams.","services":["Development & integration","Mobile Apps","Nuxt consulting"],"resources":[{"name":"Discover what Passionate People can do for you","url":"https://passionatepeople.io/client-spotlight-stories/?ref=nuxt"}],"emailAddress":null,"phoneNumber":null,"twitter":"passionpeopleNL","github":"passionatepeople","color":["#410e72","#5bcca7"],"location":"Amsterdam, NL","empty":true,"body":{"raw":"---\ntitle: \"Passionate People\"\ndescription: \"Passionate People provide you with additional technical capacity to power-up your digital transformation journeys with our teams of first-class engineers and consultants. Full stack JavaScript Cloud Engineers ready to work with you and your teams.\"\nlogo: \"/img/companies/square/dark/passionate-people.jpeg\"\nlogoFull: \"/img/companies/full/light/passionate-people.webp\"\nlink: https://passionatepeople.io/?ref=nuxt\nicon: passionate-people.jpeg\nfullDescription: \"Passionate People provide you with additional technical capacity to power-up your digital transformation journeys with our teams of first-class engineers and consultants. Full stack JavaScript Cloud Engineers ready to work with you and your teams.\"\nservices:\n  - Development & integration\n  - Mobile Apps\n  - Nuxt consulting\nresources:\n  -\n    name: 'Discover what Passionate People can do for you'\n    url: 'https://passionatepeople.io/client-spotlight-stories/?ref=nuxt'\nemailAddress:\nphoneNumber:\ntwitter: 'passionpeopleNL'\ngithub: 'passionatepeople'\ncolor:\n  - '#410e72'\n  - '#5bcca7'\nlocation: Amsterdam, NL\n---\n","ast":{"type":"root","children":[]},"toc":{"title":"","searchDepth":2,"depth":2,"links":[]}}}