{"key":"content:_collections:partners:technology:1.vercel.md","generatedAt":"2022-04-21T11:59:24.352Z","mtime":"2022-04-21T11:59:24.351Z","slug":"vercel","title":"Vercel","position":"999999999999","to":"/collections/partners/technology/vercel","draft":false,"page":false,"language":"en","description":"Vercel combines the best developer experience with an obsessive focus on end-user performance. Our platform enables frontend teams to do their best work.","icon":"vercel.svg","logo":{"light":"/img/companies/square/light/vercel.svg","dark":"/img/companies/square/dark/vercel.svg"},"logoFull":"/img/companies/full/dark/vercel.png","link":"https://vercel.com/?ref=nuxt","fullDescription":"Vercel is the best place to deploy any frontend app. Start by deploying with zero configuration to our global edge network. Scale dynamically to millions of pages without breaking a sweat.","services":["Hosting","Cloud","Serverless"],"resources":[{"name":"Get started","url":"https://vercel.com/#get-started"}],"emailAddress":null,"phoneNumber":null,"twitter":"vercel","github":"vercel","color":["#0070f3"],"location":null,"empty":true,"body":{"raw":"---\ntitle: Vercel\ndescription: \"Vercel combines the best developer experience with an obsessive focus on end-user performance. Our platform enables frontend teams to do their best work.\"\nicon: vercel.svg\nlogo: \n  light: \"/img/companies/square/light/vercel.svg\"\n  dark: \"/img/companies/square/dark/vercel.svg\"\nlogoFull: \"/img/companies/full/dark/vercel.png\"\nlink: https://vercel.com/?ref=nuxt\nfullDescription: \"Vercel is the best place to deploy any frontend app. Start by deploying with zero configuration to our global edge network. Scale dynamically to millions of pages without breaking a sweat.\"\nservices:\n  - Hosting\n  - Cloud\n  - Serverless\nresources:\n  -\n    name: 'Get started'\n    url: 'https://vercel.com/#get-started'\nemailAddress:\nphoneNumber:\ntwitter: 'vercel'\ngithub: 'vercel'\ncolor:\n  - '#0070f3'\nlocation:\n---\n","ast":{"type":"root","children":[]},"toc":{"title":"","searchDepth":2,"depth":2,"links":[]}}}