{"key":"content:_collections:partners:technology:0.netlify.md","generatedAt":"2022-04-21T11:59:24.351Z","mtime":"2022-04-21T11:59:24.351Z","slug":"netlify","title":"Netlify","position":"999999999999","to":"/collections/partners/technology/netlify","draft":false,"page":false,"language":"en","description":"Netlify makes CI/CD, deployment and scaled hosting a commodity and helps enterprises focus on creating great dynamic consumer experiences in a Jamstack environment.","icon":"netlify.svg","logo":"/img/companies/square/dark/netlify.svg","logoFull":"/img/companies/full/dark/netlify.svg","link":"https://www.netlify.com/?ref=nuxt","fullDescription":"Netlify is on a mission to make a more independent web that is faster, simpler and safer. Simply put, it is the fastest way to build the fastest sites.\n\nUsed by millions of web developers and businesses, the Netlify platform provides modern build workflows, serverless functions and a global Edge Network to deliver the most performant, secure and scalable websites and applications.\n\nNetlify pioneered the Jamstack category, a modern web architecture that marries the best practices of static sites with the API economy and serverless functions, to deliver the faster load times and dynamic content, without worrying about web servers. Founded in 2014, Netlify is a venture-backed software company headquartered in San Francisco with a global team.","services":["Hosting","Cloud","Serverless"],"resources":[{"name":"Get started","url":"https://docs.netlify.com/#get-started"}],"emailAddress":null,"phoneNumber":null,"twitter":"netlify","github":"netlify","color":["#20C6B7","#4D9ABF"],"empty":true,"body":{"raw":"---\ntitle: Netlify\ndescription: \"Netlify makes CI/CD, deployment and scaled hosting a commodity and helps enterprises focus on creating great dynamic consumer experiences in a Jamstack environment.\"\nicon: netlify.svg\nlogo: \"/img/companies/square/dark/netlify.svg\"\nlogoFull: \"/img/companies/full/dark/netlify.svg\"\nlink: https://www.netlify.com/?ref=nuxt\nfullDescription: \"Netlify is on a mission to make a more independent web that is faster, simpler and safer. Simply put, it is the fastest way to build the fastest sites.\n\n\nUsed by millions of web developers and businesses, the Netlify platform provides modern build workflows, serverless functions and a global Edge Network to deliver the most performant, secure and scalable websites and applications.\n\n\nNetlify pioneered the Jamstack category, a modern web architecture that marries the best practices of static sites with the API economy and serverless functions, to deliver the faster load times and dynamic content, without worrying about web servers. Founded in 2014, Netlify is a venture-backed software company headquartered in San Francisco with a global team.\"\nservices:\n  - Hosting\n  - Cloud\n  - Serverless\nresources:\n  -\n    name: 'Get started'\n    url: 'https://docs.netlify.com/#get-started'\nemailAddress:\nphoneNumber:\ntwitter: 'netlify'\ngithub: 'netlify'\ncolor:\n  - '#20C6B7'\n  - '#4D9ABF'\n---\n","ast":{"type":"root","children":[]},"toc":{"title":"","searchDepth":2,"depth":2,"links":[]}}}