{"key":"content:_collections:partners:agency:6.software-things.md","generatedAt":"2022-04-23T01:43:25.572Z","mtime":"2022-04-23T01:43:25.571Z","slug":"software-things","title":"Software Things","position":"999999999999","to":"/collections/partners/agency/software-things","draft":false,"page":false,"language":"en","description":"At Software Things we focus on bringing a unique value with your digital product. Our tech-savvy team accompanies you through the entire lifecycle of creating a digital product. We help you to discover your audience's needs and address them through aesthetic design and well-working products.","logo":{"light":"/img/companies/square/light/software-things.svg","dark":"/img/companies/square/dark/software-things.svg"},"logoFull":"/img/companies/full/light/software-things.svg","link":"https://softwarethings.pro/?ref=nuxt","icon":"software-things.svg","fullDescription":"At Software Things we focus on bringing a unique value with your digital product. Our tech-savvy team accompanies you through the entire lifecycle of creating a digital product. We help you to discover your audience's needs and address them through aesthetic design and well-working products. \n\nOur team of talents brings business value with the variety of products we develop: web apps, mobile apps and websites.\n\nWe believe that working on a successful product is not just about turning a vision into something real, it’s also about business strategy and a long-lasting relationship with your audience – so that they are not just statistics but part of your engaged and lasting community.","services":["Product Development","Web Applications","JAMStack Websites","Mobile Applications","Development & Integration"],"resources":[{"name":"Find out what we can do for your business","url":"https://softwarethings.pro/services/?ref=nuxt"},{"name":"See our accomplishments","url":"https://clutch.co/profile/software-things#summary"}],"emailAddress":"hello-nuxt@softwarethings.pro","phoneNumber":null,"github":"software-things","facebook":"sftwrthings","linkedin":"software-things","color":["#1b1b1b","#55bd90"],"location":"Katowice, PL","empty":true,"body":{"raw":"---\ntitle: \"Software Things\"\ndescription: \"At Software Things we focus on bringing a unique value with your digital product. Our tech-savvy team accompanies you through the entire lifecycle of creating a digital product. We help you to discover your audience's needs and address them through aesthetic design and well-working products.\"\nlogo: \n  light: \"/img/companies/square/light/software-things.svg\"\n  dark: \"/img/companies/square/dark/software-things.svg\"\nlogoFull: \"/img/companies/full/light/software-things.svg\"\nlink: https://softwarethings.pro/?ref=nuxt\nicon: software-things.svg\nfullDescription: \"At Software Things we focus on bringing a unique value with your digital product. Our tech-savvy team accompanies you through the entire lifecycle of creating a digital product. We help you to discover your audience's needs and address them through aesthetic design and well-working products. \n\n\nOur team of talents brings business value with the variety of products we develop: web apps, mobile apps and websites.\n\n\nWe believe that working on a successful product is not just about turning a vision into something real, it’s also about business strategy and a long-lasting relationship with your audience – so that they are not just statistics but part of your engaged and lasting community.\"\nservices:\n  - Product Development\n  - Web Applications\n  - JAMStack Websites\n  - Mobile Applications\n  - Development & Integration\nresources:\n  -\n    name: 'Find out what we can do for your business'\n    url: 'https://softwarethings.pro/services/?ref=nuxt'\n  -\n    name: 'See our accomplishments'\n    url: 'https://clutch.co/profile/software-things#summary'\nemailAddress: hello-nuxt@softwarethings.pro\nphoneNumber:\ngithub: 'software-things'\nfacebook: 'sftwrthings'\nlinkedin: 'software-things'\ncolor:\n  - '#1b1b1b'\n  - '#55bd90'\nlocation: Katowice, PL\n---\n","ast":{"type":"root","children":[]},"toc":{"title":"","searchDepth":2,"depth":2,"links":[]}}}