{"key":"content:_collections:partners:agency:4.mirahi.md","generatedAt":"2022-04-22T15:48:23.059Z","mtime":"2022-04-22T15:48:23.058Z","slug":"mirahi","title":"Mirahi","position":"999999999999","to":"/collections/partners/agency/mirahi","draft":false,"page":false,"language":"en","description":"Our main goal is to support companies and individuals to achieve the best version of themselves through technology to build a future. From consulting to training sessions to code reviews. We bring technology to the core of your projects & support you in the best possible way.","logo":{"light":"/img/companies/square/light/mirahi.svg","dark":"/img/companies/square/dark/mirahi.svg"},"logoFull":"/img/companies/full/light/mirahi.png","link":"https://mirahi.io/?ref=nuxt","icon":"mirahi.svg","fullDescription":"Mirahi is a technology-driven agency who's delivers the development of software and infrastructure's projects, both for clients and internally. It covers the entire range of services from UX ideation to infrastructures implementation, as well as coaching and training in its core technologies portfolio.\n\nMirahi possesses internal competencies and knowledge on the following technologies:\n\nReact, Angular, JavaScript/Typescript, Vue JS, Svelte.js, Next.js, Nuxt.js, Svelte Kit, Nest.js, Ansible, Kubernetes, VM Ware, AWS, UX/UI Design/Integration (Css, Tailwind) and project management.","services":["Consulting","Product Development","Critical Engineering Support","Mentorship & Code Review","Training"],"emailAddress":"Info@mirahi.io","phoneNumber":null,"github":"mirahi-io","twitter":"mirahi_io","linkedin":"mirahi","color":["#0144C3","#F83756"],"location":"Brussels, BE","empty":true,"body":{"raw":"---\ntitle: \"Mirahi\"\ndescription: \"Our main goal is to support companies and individuals to achieve the best version of themselves through technology to build a future. From consulting to training sessions to code reviews. We bring technology to the core of your projects & support you in the best possible way.\"\nlogo: \n  light: \"/img/companies/square/light/mirahi.svg\"\n  dark: \"/img/companies/square/dark/mirahi.svg\"\nlogoFull: \"/img/companies/full/light/mirahi.png\"\nlink: https://mirahi.io/?ref=nuxt\nicon: mirahi.svg\nfullDescription: \"Mirahi is a technology-driven agency who's delivers the development of software and infrastructure's projects, both for clients and internally. It covers the entire range of services from UX ideation to infrastructures implementation, as well as coaching and training in its core technologies portfolio.\n\n\nMirahi possesses internal competencies and knowledge on the following technologies:\n\n\nReact, Angular, JavaScript/Typescript, Vue JS, Svelte.js, Next.js, Nuxt.js, Svelte Kit, Nest.js, Ansible, Kubernetes, VM Ware, AWS, UX/UI Design/Integration (Css, Tailwind) and project management.\"\nservices:\n  - Consulting\n  - Product Development\n  - Critical Engineering Support\n  - Mentorship & Code Review\n  - Training\nemailAddress: Info@mirahi.io\nphoneNumber:\ngithub: 'mirahi-io'\ntwitter: 'mirahi_io'\nlinkedin: 'mirahi'\ncolor:\n  - '#0144C3'\n  - '#F83756'\nlocation: Brussels, BE\n---\n","ast":{"type":"root","children":[]},"toc":{"title":"","searchDepth":2,"depth":2,"links":[]}}}