{"key":"content:en:_collections:testimonials:index.md","generatedAt":"2022-04-22T12:51:44.255Z","mtime":"2022-04-22T12:51:44.254Z","slug":"","title":"","position":"999999999999","to":"/collections/testimonials","draft":false,"page":false,"language":"en","testimonials":[{"testimonial":"Nuxt offers a compelling solution and a great ecosystem to help you ship fullstack Vue apps that are performant and SEO friendly. The flexibility to choose between SSR and SSG is icing on the cake.","author":"Evan You","authorIcon":"evan","authorUrl":"https://twitter.com/youyuxi","job":"Creator of Vue.js","jobIcon":"vue","jobUrl":"https://vuejs.org"},{"testimonial":"Nuxt has outstanding developer productivity, experience, and performance right out of the gate!<br/>There’s so much attention to detail, ensuring teams have everything at their fingertips to productively build all manners of applications.","author":"Sarah Drasner","authorIcon":"sarah","authorUrl":"https://twitter.com/sarah_edo","job":"Core Team of Vue.js","jobIcon":"vue","jobUrl":"https://vuejs.org"},{"testimonial":"Nuxt is a fantastic choice for teams building a production-grade product on the web. It aims to bake in performance best-practices while maintaining excellent Vue.js DX.","author":"Addy Osmani","authorIcon":"addy","authorUrl":"https://twitter.com/addyosmani","job":"Chief Engineer of Chrome","jobIcon":"chrome","jobUrl":"https://www.google.com/chrome/"},{"testimonial":"Nuxt has been an incredible source of innovation and inspiration for developers and framework authors alike. It’s been amazing to see its growth in web projects of all sizes on the web.","author":"Guillermo Rauch","authorIcon":"guillermo","authorUrl":"https://twitter.com/rauchg","job":"Founder of Vercel","jobIcon":"vercel-light","jobIconDark":"vercel-dark","jobUrl":"https://vercel.com"},{"testimonial":"Nuxt has a unique approach of combining a great developer experience with reusable, fully integrated features that speed up the development and performance of your next website or application.","author":"Dominik Angerer","authorIcon":"dominik","authorUrl":"https://twitter.com/domangerer","job":"Founder of Storyblok","jobIcon":"storyblok","jobUrl":"https://www.storyblok.com"},{"testimonial":"Nuxt is our primary choice for offering a seamless website development experience to our users. Its simplicity and progressive learning curve makes it our ideal choice for SliceMachine.","author":"Sadek Drobi","authorIcon":"sadek","authorUrl":"https://twitter.com/Sadache","job":"Founder of Prismic","jobIcon":"prismic","jobUrl":"https://prismic.io"},{"testimonial":"Every serious full stack development team needs to stop take a look at Nuxt. Vue's developer productivity combined with Nuxt's server side rendering, is the foundation for instant loading web sites that delight users and improve team velocity.","author":"Ajay Kapur","authorIcon":"ajay","authorUrl":"https://www.linkedin.com/in/ajaykapur/","job":"Founder of Layer0","jobIcon":"layer0-light","jobIconDark":"layer0-dark","jobUrl":"https://www.layer0.co/"},{"testimonial":"Nuxt has an ideal balance of approachability for developers new to JAMstack, and power for experienced teams working on complex applications. The modules and first-class integration with the rest of the Vue ecosystem makes for a superb DX.","author":"Dave Loneragan","authorIcon":"dave","authorUrl":"https://twitter.com/paper_tokyo","job":"Co-founder of Swell","jobIcon":"swell","jobUrl":"https://swell.is"},{"testimonial":"The moment I used Nuxt for the first time I felt in love with it. Apart from its scalability, performance and developer experience, the team behind of it is also fantastic. Thanks for developing such a great framework and making our lives much easier!","author":"Savas Vedova","authorIcon":"savas","authorUrl":"https://www.linkedin.com/in/savas-vedova/","job":"Founder of Stormkit","jobIcon":"stormkit","jobUrl":"https://www.stormkit.io/"}],"empty":true,"description":"","body":{"raw":"---\ntestimonials:\n  -\n    testimonial: 'Nuxt offers a compelling solution and a great ecosystem to help you ship fullstack Vue apps that are performant and SEO friendly. The flexibility to choose between SSR and SSG is icing on the cake.'\n    author: 'Evan You'\n    authorIcon: 'evan'\n    authorUrl: 'https://twitter.com/youyuxi'\n    job: 'Creator of Vue.js'\n    jobIcon: 'vue'\n    jobUrl: 'https://vuejs.org'\n  -\n    testimonial:\n      'Nuxt has outstanding developer productivity, experience, and performance right out of the gate!<br/>There’s so much attention to detail, ensuring teams have everything at their fingertips to productively build all manners of applications.'\n    author: 'Sarah Drasner'\n    authorIcon: 'sarah'\n    authorUrl: 'https://twitter.com/sarah_edo'\n    job: 'Core Team of Vue.js'\n    jobIcon: 'vue'\n    jobUrl: 'https://vuejs.org'\n  -\n    testimonial:\n      'Nuxt is a fantastic choice for teams building a production-grade product on the web. It aims to bake in performance best-practices while maintaining excellent Vue.js DX.'\n    author: 'Addy Osmani'\n    authorIcon: 'addy'\n    authorUrl: 'https://twitter.com/addyosmani'\n    job: 'Chief Engineer of Chrome'\n    jobIcon: 'chrome'\n    jobUrl: 'https://www.google.com/chrome/'\n  -\n    testimonial:\n      'Nuxt has been an incredible source of innovation and inspiration for developers and framework authors alike. It’s been amazing to see its growth in web projects of all sizes on the web.'\n    author: 'Guillermo Rauch'\n    authorIcon: 'guillermo'\n    authorUrl: 'https://twitter.com/rauchg'\n    job: 'Founder of Vercel'\n    jobIcon: 'vercel-light'\n    jobIconDark: 'vercel-dark'\n    jobUrl: 'https://vercel.com'\n  -\n    testimonial:\n      'Nuxt has a unique approach of combining a great developer experience with reusable, fully integrated features that speed up the development and performance of your next website or application.'\n    author: 'Dominik Angerer'\n    authorIcon: 'dominik'\n    authorUrl: 'https://twitter.com/domangerer'\n    job: 'Founder of Storyblok'\n    jobIcon: 'storyblok'\n    jobUrl: 'https://www.storyblok.com'\n  -\n    testimonial:\n      'Nuxt is our primary choice for offering a seamless website development experience to our users. Its simplicity and progressive learning curve makes it our ideal choice for SliceMachine.'\n    author: 'Sadek Drobi'\n    authorIcon: 'sadek'\n    authorUrl: 'https://twitter.com/Sadache'\n    job: 'Founder of Prismic'\n    jobIcon: 'prismic'\n    jobUrl: 'https://prismic.io'\n  -\n    testimonial:\n      \"Every serious full stack development team needs to stop take a look at Nuxt. Vue's developer productivity combined with Nuxt's server side rendering, is the foundation for instant loading web sites that delight users and improve team velocity.\"\n    author: 'Ajay Kapur'\n    authorIcon: 'ajay'\n    authorUrl: 'https://www.linkedin.com/in/ajaykapur/'\n    job: 'Founder of Layer0'\n    jobIcon: 'layer0-light'\n    jobIconDark: 'layer0-dark'\n    jobUrl: 'https://www.layer0.co/'\n  -\n    testimonial:\n      'Nuxt has an ideal balance of approachability for developers new to JAMstack, and power for experienced teams working on complex applications. The modules and first-class integration with the rest of the Vue ecosystem makes for a superb DX.'\n    author: 'Dave Loneragan'\n    authorIcon: 'dave'\n    authorUrl: 'https://twitter.com/paper_tokyo'\n    job: 'Co-founder of Swell'\n    jobIcon: 'swell'\n    jobUrl: 'https://swell.is'\n  -\n    testimonial:\n      'The moment I used Nuxt for the first time I felt in love with it. Apart from its scalability, performance and developer experience, the team behind of it is also fantastic. Thanks for developing such a great framework and making our lives much easier!'\n    author: 'Savas Vedova'\n    authorIcon: 'savas'\n    authorUrl: 'https://www.linkedin.com/in/savas-vedova/'\n    job: 'Founder of Stormkit'\n    jobIcon: 'stormkit'\n    jobUrl: 'https://www.stormkit.io/'\n---\n","ast":{"type":"root","children":[]},"toc":{"title":"","searchDepth":2,"depth":2,"links":[]}}}