{"key":"content:_collections:partners:agency:3.curotec.md","generatedAt":"2022-04-23T04:16:14.187Z","mtime":"2022-04-23T04:16:14.186Z","slug":"curotec","title":"Curotec","position":"999999999999","to":"/collections/partners/agency/curotec","draft":false,"page":false,"language":"en","description":"Our experience extends from ground-up development using the Nuxt.js framework to side-by-side collaborations that make in-house teams more productive with Nuxt. Innovation doesn’t stop or start at a company’s size. That’s why our skilled Nuxt.js development team has helped a wide variety of businesses - from enterprises to digital-first startups - realize their vision with highly-usable, seamless, professionally-built applications.","logo":{"light":"/img/companies/square/light/curotec.jpeg","dark":"/img/companies/square/dark/curotec.jpeg"},"logoFull":"/img/companies/full/light/curotec.png","link":"https://www.curotec.com/services/technologies/vuejs/?ref=nuxt","icon":"curotec.jpeg","fullDescription":"Our experience extends from ground-up development using the Nuxt.js framework to side-by-side collaborations that make in-house teams more productive with Nuxt. Innovation doesn’t stop or start at a company’s size. That’s why our skilled Nuxt.js development team has helped a wide variety of businesses - from enterprises to digital-first startups - realize their vision with highly-usable, seamless, professionally-built applications.\n\nOur team is equipped to take your ideas from concept to launch, pairing the powerful Nuxt.js framework with complementary technologies such as Vue.js, Laravel, Node.js, WordPress, and more as well as deep software planning and design experience to transform your vision into reality. But Curotec can do more than greenfield development, drawing on the comprehensive skill set of our teams and leaders to step in at any stage of development, from planning and design to long-term support.\n\nRounding out the team with digital strategy, UX, and DevOps, Curotec engineers are positioned to partner with you to create beautiful, functional, and purpose-built applications.","services":["Development & integration","Mobile Apps","Nuxt consulting"],"resources":[{"name":"Our Work","url":"https://www.curotec.com/success-stories/?ref=nuxt"},{"name":"Our Careers","url":"https://www.curotec.com/careers/?ref=nuxt"}],"emailAddress":"sales@curotec.com","phoneNumber":null,"twitter":"curotec","linkedin":"curotec","color":["#295674"],"location":"Philadelphia, PA","empty":true,"body":{"raw":"---\ntitle: \"Curotec\"\ndescription: \"Our experience extends from ground-up development using the Nuxt.js framework to side-by-side collaborations that make in-house teams more productive with Nuxt. Innovation doesn’t stop or start at a company’s size. That’s why our skilled Nuxt.js development team has helped a wide variety of businesses - from enterprises to digital-first startups - realize their vision with highly-usable, seamless, professionally-built applications.\"\nlogo: \n  light: \"/img/companies/square/light/curotec.jpeg\"\n  dark: \"/img/companies/square/dark/curotec.jpeg\"\nlogoFull: \"/img/companies/full/light/curotec.png\"\nlink: https://www.curotec.com/services/technologies/vuejs/?ref=nuxt\nicon: curotec.jpeg\nfullDescription: \"Our experience extends from ground-up development using the Nuxt.js framework to side-by-side collaborations that make in-house teams more productive with Nuxt. Innovation doesn’t stop or start at a company’s size. That’s why our skilled Nuxt.js development team has helped a wide variety of businesses - from enterprises to digital-first startups - realize their vision with highly-usable, seamless, professionally-built applications.\n\n\nOur team is equipped to take your ideas from concept to launch, pairing the powerful Nuxt.js framework with complementary technologies such as Vue.js, Laravel, Node.js, WordPress, and more as well as deep software planning and design experience to transform your vision into reality. But Curotec can do more than greenfield development, drawing on the comprehensive skill set of our teams and leaders to step in at any stage of development, from planning and design to long-term support.\n\n\nRounding out the team with digital strategy, UX, and DevOps, Curotec engineers are positioned to partner with you to create beautiful, functional, and purpose-built applications.\"\nservices:\n  - Development & integration\n  - Mobile Apps\n  - Nuxt consulting\nresources:\n  -\n    name: 'Our Work'\n    url: 'https://www.curotec.com/success-stories/?ref=nuxt'\n  -\n    name: 'Our Careers'\n    url: 'https://www.curotec.com/careers/?ref=nuxt'\nemailAddress: sales@curotec.com\nphoneNumber:\ntwitter: 'curotec'\nlinkedin: 'curotec'\ncolor:\n  - '#295674'\nlocation: Philadelphia, PA\n---\n","ast":{"type":"root","children":[]},"toc":{"title":"","searchDepth":2,"depth":2,"links":[]}}}