{"key":"content:_collections:partners:technology:5.vue-storefront.md","generatedAt":"2022-04-23T04:16:14.194Z","mtime":"2022-04-23T04:16:14.193Z","slug":"vue-storefront","title":"Vue Storefront","position":"999999999999","to":"/collections/partners/technology/vue-storefront","draft":false,"page":false,"language":"en","description":"Vue Storefront is a lightning fast platform for headless Commerce. Boost your site performance, shape the customer journey and free your developer's creativity.","logo":"/img/companies/square/dark/vue-storefront.svg","logoFull":"/img/companies/full/light/vue-storefront.svg","link":"https://www.vuestorefront.io/?ref=nuxt","icon":"vue-storefront.svg","fullDescription":"Vue Storefront, built with an open-source mindset and the trust of a global community, is the result of our effort to provide developers with modern and forward-thinking technical solutions crafted to meet common eCommerce industry challenges.","services":["Integration","Ecommerce"],"resources":[{"name":"Discover Vue Storefront solutions","url":"https://www.vuestorefront.io/product"}],"emailAddress":null,"phoneNumber":null,"twitter":"VueStorefront","github":"vuestorefront","color":["#02c652"],"empty":true,"body":{"raw":"---\ntitle: \"Vue Storefront\"\ndescription: \"Vue Storefront is a lightning fast platform for headless Commerce. Boost your site performance, shape the customer journey and free your developer's creativity.\"\nlogo: \"/img/companies/square/dark/vue-storefront.svg\"\nlogoFull: \"/img/companies/full/light/vue-storefront.svg\"\nlink: https://www.vuestorefront.io/?ref=nuxt\nicon: vue-storefront.svg\nfullDescription: \"Vue Storefront, built with an open-source mindset and the trust of a global community, is the result of our effort to provide developers with modern and forward-thinking technical solutions crafted to meet common eCommerce industry challenges.\"\nservices:\n  - Integration\n  - Ecommerce\nresources:\n  -\n    name: 'Discover Vue Storefront solutions'\n    url: 'https://www.vuestorefront.io/product'\nemailAddress:\nphoneNumber:\ntwitter: 'VueStorefront'\ngithub: 'vuestorefront'\ncolor:\n  - '#02c652'\n---","ast":{"type":"root","children":[]},"toc":{"title":"","searchDepth":2,"depth":2,"links":[]}}}